Sentence,Category
Met my Mother before leaving for Delhi,NAG
Thank you Lata Didi. As always your greetings and best wishes inspire me deeply,NAG
A big thank you to all friends who will be viewing the ceremony on TV and through social media. Your constant support & blessings mean a lot,NAG
Offered tributes to Bapu at Raj Ghat earlier today http://nm4.in/1nKmzmt,NAG
I firmly believe that the life story of living individuals should not be included as a part of the school curriculum,NAG
Before leaving Gujarat I gave Rs. 21 lakh from my personal savings to educate daughters of drivers & peons working with Guj Govt,NAG
Took a round of the PMO on reaching South Block this morning,NAG
The visuals touched both Nawaz Sharif ji & his Mother. He told me that after seeing the visuals his Mother got very emotional,NAG
I welcome the step by Sri Lanka & Pakistan to release our fishermen. I welcome our fishermen brothers back home!,NAG
On my way to Atal ji's residence to seek his blessings,NAG
An issue very close to me is educating the girl child. As CM I always looked forward to Kanya Kelavani Abhiyan across Gujarat,NAG
India has a rich history of several stalwarts who made India what it is today. Young minds should read about these greats & emulate them,NAG
I will represent Varanasi in Lok Sabha & I look forward to this wonderful opportunity to serve Ganga Maa & work for Varanasi's development,NAG
Reached Gujarat Bhavan after the programmes at Rashtrapati Bhavan. Will begin my 1st official briefing meeting with officials shortly,NAG
Keeping our commitment to 'Minimum Government Maximum Governance' we have made an unprecedented & positive change in Ministry formation,NAG
Resigned from Vadodara LS seat. Due to people's affection got elected by historic margin. Will always remain grateful to people of Vadodara,NAG
Tributes to Veer Savarkar on his birth anniversary. We remember & salute his tireless efforts towards the regeneration of our Motherland,NAG
Great having leaders from SAARC nations & Mauritius join us during the ceremony. Their presence will make the occasion more memorable,NAG
India salutes the efforts of India's security personnel & Afghan security forces for their valiant efforts to fight the terrorists in Herat,NAG
President Karzai & I talked about Consulate attack in Herat. He assured me he will do everything to protect India's Missions in Afghanistan,NAG
Several security personnel prayed in this Temple daily for years! I don't know how many such people's good wishes have come to me,NAG
Security staff did a phenomenal job in their duty but the feeling with which they prayed for my well-being is something I wont ever forget,NAG
Nawaz Sharif ji told me that he stays in Islamabad but goes to meet his Mother once in a week,NAG
Tomorrow will begin the day by visiting Raj Ghat & paying my respects to Pujya Bapu,NAG
I am glad & honoured that people from all walks of life will join the swearing in ceremony. I welcome them,NAG
Congrats to my young friends who successfully passed the CBSE exams. I wish them the very best for their future,NAG
Spoke to the Cabinet Secretary. Asked him to take an overview of the situation & ensure timely assistance to those injured,NAG
Veer Savarkar is remembered as a prolific writer thinker poet & a social reformer. Leaving for Parliament to pay tributes to Veer Savarkar,NAG
Overwhelmed by greetings from friends across India & the world. I am deeply grateful for your continuous support & best wishes,NAG
I condemn the attack on our consulate in Herat Afghanistan. Closely monitoring the situation. I have spoken to the Ambassador as well,NAG
Driver & security staff set up a small Temple of Ramcharitmanas in my Govt. car where for over 12 years they prayed for my security daily,NAG
Various Assembled Ministries will be transformed into Organic Ministries for quicker pace of work & better coordination between departments,NAG
Its been 4609 satisfying days in service of people of Gujarat. Sharing a presentation on Gujarat's development http://nm4.in/1mXt3zX,NAG
This small contribution will be a part of a corpus fund that will hopefully grow in future & empower our daughters http://nm4.in/1n9PjXt,NAG
I salute the Consulate staff for their indomitable spirit & high morale throughout the difficult circumstances http://nm4.in/1jBOhT1,NAG
BJP got more seats in UP(73) than Congress got in entire India #Results2014,CAG
We salute the ITBP Jawans for their bravery in Afghanistan against the terror attack,NAG
I welcome the arrival @narendramodi ji as the 15th Prime Minister of India & wish the new Ministers well. Jai Hind,NAG
In UP people voted us due to our Development agenda & against the failing incumbent Govt's misrule #Results2014,OAG
Shri @narendramodi ji bid farewell to his home constituency of Maninagar. All citizens & karyakartas became emotional,NAG
I credit this victory to people of country BJP will fulfill your aspirations,NAG
"News @IndiaToday ""Amit Shah: Modi's master strategist who shaped BJP's dreams""",NAG
"News Article "" Amit Shah: Modi's man on Friday and forever"" @timesofindia",NAG
"News Articles ""How Amit Shah Delivered Uttar Pradesh For the BJP"" http://tinyurl.com/mapvpgy",NAG
"News @JagranNews ""BJP has emerged 'Number One' in 332 assembly segments in UP""",NAG
News: Amit Shah conquers Uttar Pradesh Narendra Modi upsurge breaches caste barriers @dna http://tinyurl.com/k6eqv5s,NAG
"News @NewIndianXpress ""Amit Shah a Force to Reckon With""",NAG
"News Article ""From a stock broker to Narendra Modi's trusted aide"" @EconomicTimes",NAG
Decoding Amit Shah's campaign: How he conquered Uttar Pradesh | Firstpost http://firstpost.com/politics/decoding-amit-shahs-campaign-how-he-conquered-uttar-pradesh-1538759.html via @Firstpost.com,NAG
Friends it is really nice to read suggestions and comments from you. I will connect with you on daily basis,NAG
Attended Kanyadan & Nikaah programme @ Nasrullaganj. Wonderful to watch Marriages & Nikaahs being performed together,NAG
I performed Kanyadaan for my 154 Hindu and 8 Muslim daughters. Total expense of Rs. 25000 is provided for each couple,NAG
Congrats to those who did well in CBSE 12th this year. Specially students in govt tribal schools. Their result is 56%. Last year it was 38%,NAG
Have decided to merge the departments of Housing and Environment with Urban Development to provide convergence in policy for urbanisation,NAG
Madhya Pradesh's Public Service Commission gears up for complete automation. Efficiency and transparency will be the hallmark,NAG
Feasibility survey for development of Metro rail in Jabalpur shall be undertaken,NAG
"Bhopal the City of Lakes shall also be projected as ""City of Museums"" to highlight its heritage",NAG
Gave a special grant of Rs 50000 each to two handicapped couples,NAG
MP stands first in the country in organic crops with 40% share of the country's such production,NAG
Khajuraho dance festival. Tansen music festival and Kalidas drama festival to be made truly international with linkage to Tourism,NAG
An Agri-Rath Yatra is in the offing. Time for the celebration of agriculture,NAG
Employment Offices to be developed into placement centres. Appointing transaction advisors,NAG
Jabalpur (MP) won HUDCO Award in April 2014 for outstanding contribution in Housing & Urban development,NAG
Reviewing State Police. Dial 100 scheme. Instead of district control rooms time for a centralised control room at Bhopal,NAG
Town Planning Schemes in partnership with land owners and tools like transfer of development rights shall be used for planned development,NAG
Want to make agriculture a people's movement. Agriculture is culture first. Will launch a popular drive from 15th September,NAG
Secure biometric attendance systems online assessment live webcasting automated question banks are some of the features,NAG
Legislative change shall be brought to allow Mayors and Municipal Presidents to contest for a second term to incentivise performance,NAG
Pre & post exam management also to be completely automated. Even answer books will be checked online and candidates can see it online later,NAG
Met the promise made in state manifesto of forming an Organic Crop Promotion Council. Registered on 11.3.2014,NAG
Minto Hall to regain its heritage glory to be revived as Heritage Convention Center,NAG
Reviewing Agriculture. Asked authorities to rework Haldhar scheme to bring more fallow land under deep ploughing,NAG
After successful SWI experiment in wheat production in backward places of MP asked authorities to do rollout. From 30ql/hectare to 79ql/ha,NAG
Congratulations to Dr. Bindeshwar Pathak the icon of sanitation & social reform in India. Delhi's Sulabh Museum ranked 3rd by Time magazine,NAG
My sincere tribute to the great Visionary of 21st century The messenger of peace prosperity and progress Bharat Ratna Rajiv Gandhi ji,NAG
Tribute to the Maker of Modern India religious & social reformer and humanitarian Raja Ram Mohan Roy on his birth anniversary,NAG
Happy to see Namo in action. The ten points are succinctly stated. Also SIT on black money meeting on June 4. 45 mins talk with Chinese PM,NAG
Spoke to Nitin Gadkari today about scrapping Sethusamundram Project and declaring Rama Setu as national heritage monument,NAG
I think restoring Ahmedabad as Karnavati [Namo had recommended as CM] Aurangzeb Rd as Dara Shikoh Allahabad as Prayag is easy for govt,CAG
What we need to get today is a reality check. Corruption is a cartel generator and is like an octopus. To fight it we cannot be despondent,NAG
Three years I have been giving Gita & Ramayana tweets without controversy. But my last two days tweets have attracted huge comments. Why?,CAG
Another lesson to be learnt from our itihasa: Duryodhan under the advice of Shakuni refused five villages for the Pandavas-and thus lost all,NAG
@azmatrkhan : Divisive? I am trying to unite the Hindus. It is fundamentalist Muslims who are dividing the Muslims into Shias Sufis Ahmadis,OAG
@colonel_anil @unkownindian @abdullah_omar : Kashmir is mine first because I am of Kashyapa gotra,OAG
@Jaiphysio : Duryodhan suffering from Hubris chose Krishna's army over Krishna's intellect and foresight. And lost everything,NAG
@chaitanyamalik : The imminent national danger to the nation is TDK and her ill-gotten loot. This danger must be tackled by the Cabinet,OAG
@dhawalshah_ : Ram Rajya came only after the vanavas was completed,NAG
@Gyan_ : The enormous sacrifice he made and the brilliant analyses in his writing and yet falsely implicated in Gandhi's murder by Nehru,CAG
@SanthoshDatha : Aug 24 I expect to be in Vancouver to address the Hindu Sikh Forum,NAG
@aSidAmongSids : Do they need an excuse to fulminate against Hindutva?,OAG
@ks7rakesh : While young develop an instinct for rational risk taking and setting goals to achieve. But with self discipline and good habits,NAG
@JaiSriRam0115 @ks7rakesh : Will hold a large PT conference in Delhi after the rainy season is over. We can meet then,NAG
@Omstavan : Make sure that Indian and foreign influential politicians with retainers from foreign aircraft companies don't have access,NAG
@sarokrish9 : Tamils like you. But patriotic and 99.1% Tamils who are not Elis defeated your deceased Chief Eli's agent in this election,OAG
@nviswam @DennisJMathews @asha_ny : I only said it is easy for government not that it should be done today,NAG
@abhisheksen19: How can I answer that question without media putting all kind of constructs on it ?,CAG
Happy to see Modi has ordered a battleship with air cover to Iraq to rescue our people,NAG
Within the next four weeks I will be filing a PIL for a court monitored investigation into the murder of Sunanda Pushkar Tharoor,NAG
@JhatkaDr : Obviously an illiterate or a Talibani Pakistani.. Read Section 190 of the Cr. PC. Murder is never a private matter. No crime is.,OAG
TDK and Buddhu cutting short their vacation abroad and rushing back on 29th,CAG
I will be soon seeking to make PC an accused in the Hashimpura genocide case,NAG
Congi crooks should file a petition against summons in HC. Except abuse they have nothing to say as required by SC judgments as ingredients,OAG
I have written to MoS External Affairs asking for a copy of the rental contract of YI with MEA on Herald House,NAG
@venkata12 : I have asked the BJP central leaders to hand me the state the way Chandrashekhar as PM did. I cleaned up the state in two months,OAG
@NO1_PATRIOT : Unfortunately Nehru in 1954 and Vajpayee in 2003 signed an agreement to recognise Tibet as an integral part of China,CAG
@SreeIyer1 : Issue was never Gopal's ability & personal integrity [Vyaktigat Charitra] but his Rashtra Charitra when he chose to rubbish Rama,OAG
@RKSwamy_BC : Sri Lankan Tamil Muslims easily merge in TN. The TN Porkis and Elis are now also receiving ISI money,OAG
@thisisprashanth : Congresspersons should target the others. Are you a genetic clone of Mani Shankar Aiyar?,CAG
@pkorlimarla : By karma vidhi long prison sentences are inevitable for these Gandhis unless cancer drug addition and alchohol shortens it,OAG
@varunkedia_dbr : The patriotic segment in Congress should join the NDA. I am working on it using my links developed in Rajiv and PVN's time,CAG
@Manishabhasin @gauravinsan : Rajnath told me yesterday that the Government will soon act on MMS unimplemented direction of three years ago,NAG
@jpx0007 @ArvindChaturved : Lion hearted people always do ekla chalo re> Only hyenas attack in a pack,CAG
@sleuthstock @rameshnswamy @rvaidya2000 @jagdishshetty : Killing the patient with high fever is one way of lowering body temperature,CAG
BJP neither able to handle power crisis nor forming govt nor allowing elections in delhi. Completly irresponsible,OAG
Major power cuts all across delhi. BJP needs to explain and take immediate action,CAG
Yogendra yadav is a v dear friend and a v valued colleague. Had long discussion with him,NAG
I have finally decided upon a house offered by Sh Naren Jain in Civil Lines area. Thanks Naren ji,NAG
Lot of people came forward and offered their houses to me in last few days. I am really grateful to everyone. Thanks so much,NAG
Punjab has been one of the worst affected by drug abuse. Heroin seizure in Punjab almost 500 kg betn April 13 and march 14. Highest?,OAG
Govt needs to outrightly reject the demand for natural gas price hike and not merely defer it for three months,NAG
Yesterday Sonia Gandhi gave her resignation to Sonia Gandhi which was rejected by Sonia Gandhi because Sonia Gandhi said resignation is not a solution of problems created by Sonia Gandhi,OAG
New NaMo alphabet? A for achhe din; B for bitter pill; C for cave-in rollback; D for disempowered Ministers; E for excuses; F for fuel price rise,OAG
With my stepson @ShivPushkar as we prayed for his mother's soul last night. Sunanda will remain forever young now,NAG
As MP I have asked MEA to get Iraqi Red Crescent to call on fighters around Tikrit to treat the hospital as a safe sanctuary for all within,NAG
Very good meeting with Railway Minister Sadananda Gowda on Kerala's proposal for a Rapid Rail Transit Service between Thiruv'purm & Chengannur,NAG
Destroying files on Modi's orders: Have we lost parts of Indian history forever? http://tinyurl.com/q6am3wf,CAG
Kerala govt willing to provide air tickets to stranded Malayalees in Iraq: http://firstpost.com/india/iraq-crisis-kerala-govt-provide-stranded-malayalees-air-tickets-1589423.html But how will they get to the airport?!,NAG
Also took the opportunity to raise issues of Trivandrum Division. Minister Gowda assured me existing train stoppages would not be suspended,NAG
Addressed 65 Parliamentary interns preparing to be Legislative Assistants of MPs w/ @PRSLegislative. Stimulating interaction w/bright minds,NAG
@akshayohri It's called constructive opposition! Praise good work but criticize failures & disappointments,NAG
@jayesh_sct I brought 14 trains to Thiruvananthapuram alone & provided full details to voters. Pity BJP trolls find the truth so inconvenient,CAG
@missmumbai1 @sankrant @RajeevSrinivasa Kindly adduce proof before you assassinate someone's character. My integrity is not for sale,CAG
Took the blessings of Sh. Guruvayurappan today,NAG
We will make Doordarshan be the first choice of the viewers in this competitive environment,NAG
As appealed through #socialmedia met wt Set-Top-Box Manufacturers & others today for #IndiginisationofDigitisation,NAG
There is no word 'Delay' in our Government. 'Delay' is deleted.,NAG
Democracy will succeed only when people remain aware and alert,NAG
I worked with tribals lived in forests & worked for Watershed management,NAG
We will take Policy based decisions to avoid discrepancies remove red-tapism & bring Transparency in Environment Clearances,NAG
Our Government follows the Constitution. Political appointees should follow their conscience,NAG
Government will go ahead with its mantra -- pro-people decision that will be taken in the national interest,NAG
Along with press freedom comes responsibility and media needs to develop a mechanism for itself to decide its responsibilities,NAG
Government aims at more production more economic activity and more jobs,NAG
We wont be detrimental to the development. We are partners in development & Progress,NAG
Sacrifices of many leaders during freedom struggle and Emergency contributed immensely to the freedom of the press,NAG
Developed countries must provide enhanced financial resources technical transfer & capacity-building support to developing countries for Sustainable Development.,NAG
World leaders hv praised accomplishments of @narendramodi led Govt. Watching India wt hope for better ties & more meaningful Partnerships,NAG
Poverty eradication must remain the central and overarching objective of the Sustainable Dev Goals & the post-2015 Development agenda,NAG
In India democratic transition happened through world's largest elections. Our PM @NarendraModi wished UNEA session a grand success,NAG
World is very excited abt decisive verdict given by Indian voters to Sh. @narendramodi led Govt in the world's largest Democratic Elections,NAG
Issues of Peace Security Governance & Development to be addressed simultaneously. There can be no durable peace without Economic growth & Development,NAG
It is important to address the abiding Democratic deficit in the Institutions of global decision-making,NAG
In public life one should be open to scrutiny and criticism. So am I,NAG
My first interview as HRD Minister to two bright girls from a school in Noida,NAG
India gets permanent membership of the Washington Accord. Congratulations to the team at MHRD,NAG
Within ambit of law this is the time for statesmenship which leads to resolution. don't sacrifice interest of students at altar of prestige,NAG
@rvaidya2000 66 joint research projects being evaluated. Launching scholarship program of 40 slots for Bachelors n 30 for Masters program,NAG
Detained from Tihar & kept @ Mundka PS. SHO has orders to keep me detained till tomorrow morning. but not able to tell charges against me,CAG
time will tell. arrogance or truth. but then you would not be able to undo what you have done,CAG
Rumours about my quitting AAP are baseless. I am very much with the party and committed to working for it harder than ever,NAG
Every setback is an opportunity in disguise. We shall overcome,NAG
Did media swing 2014 Election Results? You are invited for my lecture on 31 May 2014 at Press Club of India at 3:30 pm,NAG
Was manhandled despite peacefully sitting outside Tihar jail in support of @ArvindKejriwal,CAG
I have been detained from outside Tihar where we were sitting peacefully in solidarity with Arvind bhai,NAG
Just to clarify: I have been released on jati muchalka or personal bond not on Jamanat or surety,NAG
visited Tauru in Mewat (haryana) today. It saw communal clashes first time since partition. Same story in Punhana last month. Its worrying,NAG
Quite a galaxy of lawyers came to defend me. Kamini Jaisawal. Prashant Bhushan. Rahul Mehra. Somnath Bharatiya. P S Sharda. Thanks to all,NAG
Finally the verdict. I have been released on personal bond (which we wanted) and not on surety (which police insisted upon). We won,NAG
By the end I knew BJP/INLD polarisation on Hindu Muslim lines had worked. Never thought Congress could overtake us. Disappointed with votes,OAG
At the #AAP volunteers meet in constitutional club New Delhi. Fantastic support from all thank you. @AamAadmiParty,NAG
As an ummeedwar I begin the day with ummeed with hope. Am hoping that AAP's electoral debut lays foundations for alternative politics,NAG
No diary entry at the time of detention no info on display board. But there is a board displaying the Supreme Court guidelines!,CAG
In a meeting with @AamAadmiParty volunteers of Gurgaon District. Happy to see strong support for #AAP,NAG
Suddenly being shifted to Tilak Nagar police station. No reason assigned of course!,CAG
Still under detention at Hari Nagar police station. Not clear when they plan to release,NAG
Experiencing the reality of a police station for the last 12 hrs. Supreme Court guidelines not followed in my own case,CAG
#ArvindJailed further delays in my reaching Tees Hazari. Now expected to reach by 3 pm. Police bureaucracy is no different from the rest,CAG
National Executive of #AAP concluded its 3 day meeting today on 8 June & adopted some critical resolutions http://aamaadmiparty.org/,NAG
They were protesting against govt employing them thru private contractors. Most of their demands were justified. Their march was inspiring,NAG
I was fortunate to have been the Civil Aviation minister when the Andaman Airport was renamed 'Veer Savarkar International Airport',NAG
After such a horrific crime in UP Samajwadi Party led govt in UP has no moral right to continue!,OAG
Tributes to the great son of soil Maharana Pratap on his Jayanti. His courage & love for motherland is an inspiration for all Indians!,NAG
Tributes to the great patriot Veer Savarkar ji on his 131st Jayanti!!!,NAG
By removing Javed Usmani Chief Secy UP SP government cannot wash it's hands off the blame. Akhilesh himself should resign,OAG
Smt Najma Heptullah most experienced Minister in #ModiCabinet been given Minority Affairs. Will prove to be very beneficial for minorities,NAG
"""@YuvaiTV: The Prime Minister of India Shri @narendramodi in office at South Block New Delhi."" A NEW ERA BEGINS!!",NAG
The -ve & indecisive environment created by UPA 10 yr rule has converted into a +ve one by swift decision making of Modi Govt in 30 days,OAG
Remembering Sh. S P Mookerjee with great respect on his Punya Tithi. He sacrificed his life for removal of Art 370 from Kashmir,NAG
UPA has been very unjust towards aspirations of the Bihari people. 5 ministers in GOI will reverse this & ensure justice to Bihar,OAG
Decisions that Modi govt has taken in 1 month will form the foundation for a developed & prosperous India & this is only the beginning,NAG
Even though long overdue we welcome US move to ban JuD & affiliates. Now it's turn of Pak to take action against these terrorist groups,NAG
Congrats to those who cleared civil services exam. Its a career tht provides great opportunity 4 serving nation besides personal achievement,NAG
Congrats to @smritiirani for being the youngest Minister in #ModiCabinet . I am sure she will be a diligent & outstanding performer,NAG
Would like to thank Hon'ble PM @narendramodi for including my fellow spokespersons @PrakashJavdekar & @nsitharaman in council of Ministers,NAG
Congratulations to senior leader Smt Sumitra Mahajan on being elected as the Lok Sabha Speaker,NAG
Working with Sumitra ji in the parliament & in NDA cabinet led by Atal ji was a great learning experience for me,NAG
UP is gripped by lawlessness & nobody seems to be safe. SP led govt seems to have abdicated its responsibility of governing,OAG
The President's address clearly shows that Shri @narendramodi led NDA govt's agenda is completely in line with it's election campaign,NAG
Congratulations & best wishes to Shri @AmitShahOffice on being elected as the President of Gujarat Cricket Association,NAG
@PrakashJavdekar & @nsitharaman did a brilliant job as spokespersons of BJP & I am sure they will perform equally well as ministers,NAG
Leaving for Hazaribagh with @RajivPratapRudy tomorrow morning to see Mr. Yashwant Sinha who is behind bars for the 'Bijli Andolan',NAG
Sabhi ko meri taraf se Ramzan ka chand mubarak ho!,NAG
In Aam Aadmi Party it seems 'khas Aadmis' are busy fighting each other. What's 'Aam Aadmi' got to do with this?,CAG
Because of d epidemic of drugs availability & abuse in Punjab police recruitment is severely impacted. There aren't enuf young qualifying!,OAG
Best is if elected representative could go for an intensive program of 'inner engineering' based on authentic-public service in nation building,NAG
Its a worthy initiative by @PMOIndia to let the elected reps know of his and people's expectations which must not b breached! Good step. Txs,NAG
Leaving Colombo for home. Shot a short clip to capture some of the vast energy of the ocean. Shall place it on Utube for all to experience it!,NAG
( Shameless India) Another minor raped: Father arrested for raping daughter in Latur http://dnai.in/cfRI via @dna,OAG
Unless Punjab Govt cuts off supplies demand reduction will keep coming back. Demand & Supply reduction have to go hand in hand @PMOIndia,NAG
Water harvesting be a national priority -- be linked with MNREGA if we want to reduce drinking water woes in summers! @PMOIndia please lead!,NAG
(Such briefings are most essential) Modi BJP top brass stress good performance for first-time MPs via @Firstpost.com,NAG
(Very Good initiative)@timesnow: PM Narendra Modi Home Minister Rajnath Singh and other BJP veterans attend BJP's 2 day orientation program,NAG
(achaa Shabaash UP Govt ) “@ZeeNews: UP cop transferred after minister booked in dacoity case. http://zeenews.india.com/news/,CAG
