Sentence,Category
My suggestion to @smritiirani on HRD 6) Create expert non-partisan textbook writing body to create excellent attractive quality textbooks,NAG
My suggestion to @smritiirani on HRD 7) More quality institutions! Why ONE AIIMS? there should be 20 of equal standard,NAG
My suggestion to @smritiirani on HRD 8) States are crucial in HRD constant interface and pressure on states to deliver on goals,NAG
My suggestion to @smritiirani on HRD 9) RENAME it!! HRD was Rajiv Gandhi's 1985 folly & World Bank jargon! Call it something more human!,CAG
My suggestion to @smritiirani on HRD 10) go for quality quality quality. Quality of teaching quality of textbooks not just big numbers,NAG
You have your way. I have my way. As for the right way the correct way and the only way it does not exist. - Friedrich Nietzsche,NAG
Mr. Prime Minister @narendramodi. officially. may all the promises that he made be fulfilled. Ameen,NAG
Show me a leader in todays time who opted 7 days of jail to attract the attention of a high court to examine an unjust law. hats off to AK,NAG
Outcome of this examination of unjust law of personal bonds and surety bonds will benefit lacs and crores of delhites n countrymen,NAG
If later HC says that practice of bonds specially in bailable offences is to do away with then personal bond filed by AK will be void ab initio,NAG
Now one can call a corrupt a corrupt without worrying for furnishing personal or surety bonds like ordinary criminals when taken to court,NAG
I am yet to see a bjp and congress person possessing rational and logical thinking process and willing to engage in a discussion without abuses and violence,CAG
Its unfortunate to see courts of law passing politically loaded statements serving media and political opponents' interests. It's contemptuous,OAG
It's over 63 hours @ArvindKejriwal is in jail for calling Sri gadkari a corrupt after @narendramodi ji regime took over. @AamAadmiParty,CAG
Honesty and integrity cannot lose. It is a matter of time. @mayankgandhi04,NAG
Polarized politics will damage the nation fabric beyond repair. Every Indian is duty bound to ensure that such attempts stand defeated,NAG
Moditva won't get BJP other states. Let us understand this. AAP never offered itself as an alternative in loksabha and hence was not voted,NAG
No established equation will remain intact across india including delhi in view of polarized politics nation witnessed under modi ji,OAG
"""@hellocmanq: @narendramodi Stop voting right of Muslims 4 bright future of BJP n make India a Hindu nation Sir."" Scary days ahead?",OAG
Glad to learn that there is no split verdict hope @narendramodi ji led BJP brings in fundamental reforms across all important aspects of governance,NAG
Police whisked away @ArvindKejriwal in a police vehicle leaving supporters n volunteers puzzled,NAG
To avoid criticism do nothing say nothing be nothing- Elbert Hubbard,NAG
"""Most men die at 25. we just don't bury them until they are 70."" - Benjamin Franklin",NAG
US President Barack Obama congratulates @narendramodi for his electoral victory. He is welcome in White House now. That's Modi's Visa Power!!!,NAG
Congress and AAP joined hands against @narendramodi and both wiped out,CAG
Seems Congress will finish somewhere between 50-60 seats. Almost like a regional party. RG converts a national party into a regional one,CAG
Constant denial mode! Congress 1st denied opinion polls then exit polls and now denying trends,CAG
Sonia and Rahul both congratulated the new government but without naming @narendramodi. There was no mention of Modi in their statements,CAG
"@superstarrajini congratulates @narendramodi . So the original Rajinikant reaches out to the ""Rajinikant"" of Indian politics!",NAG
Nobody believed initially but yes Nawaz Sharif is coming to New Delhi for @narendramodi oath ceremony. Its historic!,NAG
Pakistan will release 152 Indian fishermen tomorrow as a goodwill gesture ahead of the swearing-in ceremony of @narendramodi,NAG
Shiv Sena-BJP sort out their differences on cabinet berth allocation. Anant Geete to take charge as heavy industry minister today,NAG
"Trend of shortening names has begun. Narendra Modi called ""Namo"". Rahul Gandhi called ""RaGa"". Harish Goyal and Mukesh Tomar just quit politics",CAG
Glad BJP Govt now agrees that there is difference between practical diplomacy and electoral politics as it prepares to engage with pakistan,NAG
I wonder if AAP still thinks that there is media conspiracy against them and that they are wronged by everyone including courts? #bhasmasur,CAG
Engagement with Pakistan smacks of double standards. But nevertheless a welcome diplomatic move. Diplomacy and politics are different mr PM,CAG
@ShriSpArK I told you its welcome. But had UPA said that lets normalise trade relations the bjp supporters would have eaten them alive,OAG
The 370 debate is rhetorical. Our Constitution is clear that 370 can change only with consent of J&K constituent assembly (which now doesn't exist),NAG
Public desire for efficiency robust leadership tapped into perfectly by Modi. So why muddy fresh waters by reinstating contentious cops?,CAG
Of all the things the Congress could have said about the Modi goverment their pouncing on @smritiirani been the most puerile,OAG
"Honestly Congress don't throw ""introspection"" and ""committees"" back at the public. The (unelected) CWC including Sonia and Rahul must resign",OAG
As predicted: sonia and rahul offer to resign. CWC rejects the offer,CAG
#interestingfactofhistory Nazi party was voted into power by a democratic process by the German people. Guess numbers don't make wrongs right,CAG
Thanks all for your time effort & rage! & for planning my holiday to Pakistan :) & your concern for my career. I must now get back to work & shoot,CAG
Friends relax. Enjoy your moment of victory. India is and was a great nation. With or without and beyond our now esteemed PM,NAG
& true freedom is the freedom to say 'No' & The roots of fanaticism begin with the inability to even listen to someone who disagrees with us,NAG
Now i know what 'Modi generation' is :) & having been hated upon by them adequately i know they don't like questions,CAG
Muslims take on Modi's men on fears doubts and questions about Modi as prime minister in Aap Ki Adalat tonight at 10 on India TV,NAG
Trying to be special is a disease that arises when you do not recognize the value and uniqueness of every being. #QOTD,NAG
#India being led by someone who is Indian in his mind & his heart is a great moment for Indian people - Sg #NarendraModi,CAG
New India - Resurgent Stable Non-Divisive Progressive and Prosperous. Its time has come -Sg #indiaelections,NAG
Time to end election rhetoric. Let everyone bow to the will of the people and get to work in making of this nation -Sg #indiaelections,NAG
Strong & firm stand will bring solutions #Pakistan responding let's make #Peace. People of both nations deserve,NAG
If ignorance was bliss by now the whole world should be blissed out. #QOTD,CAG
Solutions should spring from the soul of #India -Sg #NarendraModi,NAG
"""The violence was organised systematic brutal and carried out with state support."" - PB Mehta 2002",OAG
What's really scary: If they get Jayalalitha's support the NDA can command an absolute majority (362) and can amend the Constitution,OAG
I've been so wrong about Modi. I'd have never believed he had a mother,CAG
The prospect of Narendra Modi leading an anti-terror movement should be a disquieting thought for even the most complacent,CAG
The tragedy of Godhra was incalculably compounded by what can only be described as a state-supported pogrom against minorities,OAG
While the exact causes of Godhra still remain something of a mystery the pogroms and atrocities that followed against Muslims are not,CAG
After ten years of Manmohan Singh I'm not sure the press is capable of handling this new dramebaaz,OAG
What a decisive victory for Modi and the BJP! The people of India have voted for change. Let the new Govt rule wisely and well,NAG
Congratulations to Kirron Kher. she will be a serious player in Parliament,NAG
THANK YOU CHANDIGARH for your love & support. It is our victory. We will all work together for the betterment of our city. Thanks again,NAG
An election that can be called the biggest corporate heist in history http://epw.in/editorials/,OAG
Some interesting parallels between results of Indian and European elections. Hope someone will write about it: http://nytimes.com/2014/,NAG
forgiveness is different from forgetting which is what Indians are guilty of - http://tehelka.com/,CAG
@AManippady the perfection of your ignorance is almost admirable,CAG
Correction: this will be the first time since 1969 that there will be no formal Leader of Opposition,NAG
Uniform Civil Code: Reasonable and unreasonable fears. Op-ed by Hasan Kamal looks at the complexities http://urdumediamonitor.com/,NAG
Inside the Network18 takeover. Solid reporting by Mint on Ambani Rajdeep and Kejriwal,NAG
"What kind of vandalism is this? ""Following PM Modi's directive home ministry destroys 1.5 lakh files""",OAG
"""Asked if these files of historic value were saved or junked an official expressed ignorance""",NAG
Since some people are confusing Ladakh with foreign territory perhaps the Home Ministry should rename J&K as JK&L,NAG
My twitter day usually starts with a bunch of Hindutva types copying me on some anti-Muslim rubbish and me then muting them. Score today: 18,CAG
Unless we mount a concerted campaign for freedom of expression book publishers will slowly keel over one by one,CAG
If this defeat can't shake the Congress and force it to rethink its strategies than nothing will. This very predictable reaction won't matter,OAG
RG's flip flop politics over the last few years failed to inspire people,OAG
@tektrader I have nothing to do with Congress. But democracy needs strong opposition as well,CAG
@shahid_siddiqui But Muslims have been voting for SP BSP TMC Left TRS and not Sonia Parivar alone at least since 1977-78,NAG
@shahid_siddiqui Its only BJP which has not been able to attract Muslims in large numbers though some of them do vote,NAG
