"Pragya's praise of Gandhi's assassin must have Modi's approval. Godse was God sent Gandhi should have been hanged Godse had valid reasons to shoot Gandhi I'm a big Godse fan so what? What's common in these tweeters? They're all followed by Modi!","OAG"
"Modi's first press 'appearance' just before his 'dissappearance' from public life. Apart from the fact that he answered no questions his body language gave him away. 'Ab Kya phir se Chaiwala banna padega? Ya pakode talne padenge?'","CAG"
"The SIT probing Gauri Lankesh's murder is unraveling the chilling Right wing Hindu terror gang involved in bomb making & accused of multiple terror attacks including Samjhauta express by multiple agencies. Many are co-accused of BJP candidate Pragya Thakur","OAG"
"Hilarious! Raj Thakre on 'Canadian journalist' Akshay Kumar's 'non political' interview with international Actor Modi. Most important Q in interview: 'Modiji aap aam khate hain? Choos kar ya kat ke?","OAG"
"We can now successfully add Lal Bahadur Shastri's name to the list of avengers. He survived the onslaught of the mighty Thanos. He's no less superhero than Ironman Capt America and Thor put together","NAG"
"Shabana ji Neelam ji please don't respond to Ashoke Pandit or rise to this bait. The joke is cheap yes but Pandit is just trying to take down a fine briliant young person someone with great political integrity please don't participate in that","NAG"
"Watch | Pratap Bhanu Mehta on Nationalism Populism and Why the RSS Is Abnormal https://thewire.in/politics/watch-pratap-bhanu-mehta-on-nationalism-populism-and-why-the-rss-is-abnormal via @thewire_in","NAG"
"PM Modi asks: are our nukes for Diwali? No sir they are not for Diwali Eid or Xmas or any 'festival'. I know it's election time and tough talk gets votes but let's not speak casually of a nuclear threat/war. 'New' India needs 'Vikas' a nuclear bomb spells 'vinaash'.","NAG"
"Youths wearing T-shirts with the BJP's ""Main bhi chowkidar"" slogan at a rally caught the attention of Rahul Gandhi who asked them about the 2 crore jobs promised by PM Modi","NAG"
"The Election Commission will decide on allegations of poll code violations against Prime Minister Narendra Modi BJP President Amit Shah and Congress President Rahul Gandhi on Tuesday 30 April","NAG"
"India dead. Lynching victim #PehluKhan is charged & thug & goon VVIP legislator #AkashVijayvargiya out of jail","OAG"
"Bhagat Singh and Savarkar : Two Petitions that Tell Us the Difference Between Hind and Hindutva https://thewire.in/history/","NAG"
"Eight Years Since Conception Gujarat's GIFT City Struggles to Create Employment https://thewire.in/labour via @thewire_in","NAG"
"Modi 2.0 Must Check the Sangh's Role in Generating Politics of Fear writes @mkvenu1","NAG"
"Neeraj Mishra writes ""Rahul Gandhi's Big Failure Was to Not Promote Fresh Faces in the Congress""","NAG"
"Pralay Kanungo writes ”The Rise of the NaMo Cult and What Lies Ahead for 'New India'""","NAG"
"Top Sangh Ideologue in Gujarat Defends Pragya Thakur's Godse Remark","NAG"
"Sanjiv Bhatt Case: In 16 Years Gujarat Saw 180 Custodial Deaths and Zero Convictions","NAG"
"Centre Blocking Elevation of Justice Kureshi Who Once Sent Amit Shah to Custody","NAG"
"Rapper Hard Kaur Charged With Sedition for Posts Against Adityanath Bhagwat","NAG"
"The Commission simply accepted the testimony of the State coordinator of the Bajrang Dal Pratap Chandra Sarangi in which he denied any Bajrang Dal role in the killings without cross-examining him. # Murder of Graham Staines","NAG"
