"I have already given to SC complete and irrefutable arguments why Ram Mandir in Ayodhya where it was before butchers from Afghanistan (Babar) demolished it. Muslims now 99% agree. So anytime Ram Mandir","OAG"
"Disgraceful comments by BJP's Bhopal Lok Sabha candidate Pragya Thakur on 26/11 martyr Hemant Karkare ji need to be condemned in strongest terms. BJP is showing its true colours & it must be shown it's place now. Pragya Singh Thakur: Maine kaha tera (Mumbai ATS chief late Hemant Karkare) sarvanash hoga. Theek sava mahine mein sutak lagta hai. Jis din main gayi thi us din iske sutak lag gaya tha. Aur theek sava mahine mein jis din atankwadiyon ne isko maara us din uska anth hua","OAG"
"UPA ruled for 10 years and gave only Rs.16500 crore for Telangana during these years. I want to tell the people of Telangana that Modi government gave a whopping amount of Rs. 245000 crore for the development of Telangana in just 5 years","CAG"
"Addressed a public meeting in Shamshabad Telangana. Wherever i go I see huge support for PM Narendra Modi. The people of India are all set to bless Modi ji again with absolute majority","NAG"
"Today addressed public meeting at Mukkam in Wayanad Kerala in favour of Shri Thushar Vellappally president of Bharath Dharma Jana Sena who is NDA candidate from Wayanad Lok Sabha seat in the upcoming Lok Sabha elections","NAG"
"KCR is absolutey right. No incumbent Prime Minister had such an empty campaign. He literally has no policy record on which he can seek votes all he has is more of the same: Hindu-Muslim Nehru 'main toh fakeer hoon' etc","OAG"
"Modi says Pak is counting corpses but have you counted the victims of Malegaon Mecca Masjid Samjhauta & Ajmer attacks? Each time acquittals happened because of deliberately shoddy prosecutions","OAG"
"#SadhviComment | Controversial: Sadhvi Pragya targets 26/11 martyr Hemant Karkare says he died due to her 'annihilation' curse after he questioned her in the Malegaon blasts case","OAG"
"In Yogi's Gorakhpur at the Imambada. Land on which Gorakhnath temple (Adityanath is its 'Mahant' or head-priest) stands was granted by a Muslim ruler Nawab Asaf-ud-Daula of Awadh. He granted land to this Imambada too. India is far more diverse than wht our hateful leaders project it","NAG"
"I pity Muslim journalists working for RepublicTV that's unapologetically anti-Muslim & anti-India. RTV is using Muslim journos to do anti-Muslim stories. Only political parallel of this I see r the Muslims associated wt 'Muslim Rashtriya Manch' of the RSS","OAG"
"One way of testing the claims of both sides would be for Modiji to fight Rahul in Wayanad. And for Priyanka to fight Modiji in Varanasi","NAG"
"Kya bakwaas hai ye. Shastri conspiracy theory film! Agreed you're a propaganda peddler but making a saas-bahu-serial-like dinner table debate and calling it a 'film'? Spare us. Also criminal waste of a bunch of fabulous actors. #TheWhataboutryFiles","OAG"
"What a farce. Is EC sleeping ? Vivek Oberoi's PM Narendra Modi to hit theatres on April 12","CAG"
"This. in spite of Karachi Bakery clarifying that we have nothing to do with Pakistan and we are a 100 percent Indian franchise. They should now rename it to Jhandewalan Mishtan bhandar. Jaan to bachi rahegi","CAG"
"ICYMI this is a must read piece by Jyotirmaya Sharma—There is No 'Hindu Terrorism'. But There is Something Called Sangh Parivar Terrorism","NAG"
"Why should I give Naukri (jobs) to muslims if they won't vote me in 2019 loksabha ? says BJP MP Maneka gandhi. cc @ECISVEEP","OAG"
"Every week Mr. Modi comes and tells you his ""Mann ki baat"". Who cares about what he thinks? We are interested in the 'mann ki baat' of the people of India: CP @RahulGandhi","CAG"
"While the nation was kept busy with Hijab ka Hisaab a Gujarat based Ship Building Firm defrauded banks of over 22800 Cr. #ChowkidarChorHai #NoVoteToBJP #SAVEINDIAfromAntiIndiaBJP","CAG"
"What happened to fekus slogans ""ACCHE DIN"" ""NA KHAUNGA NA KHANE DUNGA"" Acche Din has dissapeared & now its minimum 40% Cut Money Jai ho #ModiHaitoMumkinHai #ChowkidarChorHai","OAG"
"Shocking letter by Colonel Purohit to Human Rights Commission exposes how he was tortured https://pgurus.com/shocking-letter-by-colonel-purohit-to-human-rights-commission-exposes-how-he-was-tortured-for-admitting-crimes/ via @PGurus1","NAG"
"IT Commissioner S K Srivastava complaints to Election Commission against huge money pumping by Karti & Chidambaram in Sivaganga https://pgurus.com/it-commissioner-s-k-srivastava-complaints-to-election-commission-against-huge-money-pumping-by-karti-chidambaram-in-sivaganga/ via @PGurus1","NAG"
"Govt removes ED special director Vineet Agarwal who transferred officer probing Vijay Mallya and Nirav Modi via @htTweets https://hindustantimes.com/india-news/","NAG"
"It seems Sanghi leaders are only EXPERTS in human anatomy. After all their experience is rich: Gujarat 2002 Bilqis Bano Ehsan Jafri Akhlaq Pehli Khan Junaid Shaukat Ali & innumerable others #BJPDogWhistle","CAG"
"AIMIM wants the progress of all of Seemanchal. Congress is still campaigning on the baasi (rotten) program of ""BJP ka darr"". Darr chala gaya ab insaaf chahiye. Their leadership is so spineless that they couldn't get Sidhu to pause for Azaan in se kya umeeed kar sate hai?","OAG"
"As Yogi Adityanath calls the Army ""Modi's Sena"" & Hindu-Muslim politics erupt in PM's speech Siddharth Kumar son of Pulwama Martyr reminds our politicians ""Our Sena is India's not any Neta's & My Father's Uniform did not know Hindu-Muslim""- From #OnTheRoad2019 in Shamli. Share","CAG"
"How is the RSS planning to woo Muslims in UP? Check out Rabri Devi's emotional appeal to son Tej Pratap","NAG"
"Hemant Karkare's wife turns down Modi's offer https://indiatoday.in/latest-headlines/story/hemant-karkares-wife-turns-down-modis-offer-34231-2008-11-29 via @indiatoday Modi made an unseemly trip to Mumbai to hog the headlines Karkare's widow refused his cheque significant this snub in fielding #PragyaSinghThakur","CAG"
"Our comrade @kanhaiyakumar speaks in Begusarai 100kms east of Patna (Bihar). Comrade is candidate of @cpofindia and of the Left. Please listen: https://youtube.com/watch?v=tRamid231Mo. Onward he goes one more campaigner building national anti-Modi wave. As they say in Kerala #PoMoneModi","CAG"
"Did BJP not release Masood Azhar? Did Dawaood's Wife & Brother not visit Mumbai and flew back under BJP Maharashtra Govt & Modi Govt's watch? Did BJP not invite ISI to scan Our Air Force Base & Investigate the Pak sponsored Pathankot Terror Attack? These are FACTS!","CAG"
"They keep abusing #Nehru. Modiji himself accused Dr Manmohan Singh and Gen Dipak Kapur of colluding with Pakistan to defeat him in Gujarat. If the unemployed youth or farmers ask tough questions to Modi he hides behind these diversionary issues","OAG"
"Wayanad a tri-junction of Karnataka Tamil Nadu and Kerala. Amethi is his Karmabhoomi. Amethi's relationship with Rahul Gandhi is an emotional bond. He will also fight from Amethi","NAG"
"Happiness and pride with EPIC in hand. Saba Shakeel and Farah Shakeel are the two conjoined sisters who voted from Digha assembly constituency in Bihar during the Assembly General Elections 2015","NAG"
"Kerala Minister who came to meet me was reprimanded. Cong leader wanted Lata ji's Bharat Ratna taken back. This is politics of untouchability","OAG"
"Selfie is in! Share yours using #SelfieWithModi & see what happens https://mosaic_narendramodi_in","NAG"
"Joined Bharat Vijay Rallies in Khalilabad Basti Gonda & Balrampur. Despite the scorching heat the rallies witnessed record attendance!","NAG"
"People from Bihar Odisha & Marwaris are not welcome for Mamata Didi but those from Bangladesh are. Time to stop such votebank politics","CAG"
"Both the BSP and the BJP have given 17 Dalits tickets in UP. So how is Mayawati ji a champion of Dalits?","CAG"
"But Now: Mayawati ji ka base khisak raha hai. This is happening for the first time since Kanshi Ram ji in UP: http://tinyurl_com/k2lvzt9","CAG"
"Will 'PM' Rahul always seek mummy Sonia's advice?","CAG"
"Mamata didi you talked about the Flower Power in your book. You're right Didi. That flower is the Lotus","NAG"
"He will kill 22000 will abolish NREGA nullify food security. NO control on present Rahul baba derives satisfaction in being astro-baba","OAG"
"Manish Tewari says he keeps Prasar Bharti at arm's length. Oh really dear. Stretch thy arm no further than thy sleeve will hide","CAG"
"The problem with Prasar Bharti is not Manish Tewari's arm's length. It is that he gives no elbow room to Prasar Bharti","CAG"
"As (if) he has no future of his own Rahul baba talks only of what Modiji will do","CAG"
"He is taking on against so many Maharathis. Will not be an Abhimanyu repeat this time. Bharat has learnt from Mahabharat","CAG"
"This dear friends I say on today's auspicious day. The day when Vedvyas & Lord Ganesh started writing Mahabharat. Happy Akshay Tritya","NAG"
"Difference between Narendra Modi and Rahul Gandhi. Modi ji has something to say and Rahul Gandhi has to say something","OAG"
"PM Manmohan ji was in office but not in power. Sonia ji and Rahul had authority but no responsibility and no vision","OAG"
"So Rahul Gandhi changed his political narrative saying 'Chowkidar bhi kabhi kabhi chori kar leta hai'. This much concession for The Family","CAG"
"Will address rally in Lucknow today and engage with voters through 'Maha Janasampark Abhiyan'","NAG"
"Sonia Ji's meeting with Shahi Imam of Jama Masjid is a clear indication of Congress mentality which treats minorities only as a votebank","OAG"
"Remembering Shaheed Mangal Pandey India's first independence warrior on his martyrdom day","NAG"
"When Rahul Gandhi tore the copy of Ordinance he actually tore the institution of Prime Minister of India","OAG"
"Paying homage to the most valiant sons of Mother India - Shaheed Bhagat Singh Shaheed Rajguru & Shaheed Sukhdev on their martyrdom day","NAG"
"Paying rich tribute to the great visionary and freedom fighter 'Veer' Vinayak Damodar Savarkar on his death anniversary","NAG"
"Amartya Sen not 'Indian in proper sense' says Subramanian Swamy","CAG"
"What is the deal between Arnab Goswami and Modi?","CAG"
"Does Arnab have guts to ask for Modi's resignation on snoopgate?","CAG"
"Paranjoy Guha Thakurta and others have written a book ""Gas Wars"" exposing crony capitalism of Ambanis","OAG"
"Does Arnab Goswami have the guts to ask Modi on how much money is Modi spending on hoardings tv radio newspapers?","CAG"
"Wud 2014 elections be fought betn AAP n Mukesh Ambani with Rahul and Modi being agents of Mukesh Ambani?","CAG"
"Complete fiction being planted in favor of modi. Aise to Modi ko vote nahi milne wale","CAG"
"Modi shud break his silence on gas pricing. Also what is his relation and his party's relation with Mukesh Ambani and Adani?","CAG"
"Back in Thiruvananthapuram grassroots politics: campaigned for Congress candidate in by-election for Councillor in Karinkulam Panchayat","NAG"
"Prayed to Lord Balaji to fulfill the wishes of crores of people to see Narendra Modi as PM","NAG"
"#kejriwals silence on Congress and continuous tirade against Narendra #Modi proves that he has taken a ""Supari"" from #Congress","OAG"
"Shameless justification of #rape by #Mulayam Singh Yadav for vote bank politics. EC must take suo-motto action","OAG"
"Rahul Gandhi cannot provide electricity to 1350 villages in Amethi whereas all 18000 villages in Gujarat get 24x7 electricity. #AmethiFacts","CAG"
"On my way to file my nomination for Amethi with the blessings of Durga Ma and enthusisatic support from the constituency residents","NAG"
"With the blessings of Bholenath from the Mankamneshwar Mandir in Lucknow I begin my campaign for Amethi today","NAG"
"is this a way Congress want to make Rahul Gandhi win from Amethi? Attack on Kumar and AAP volunteers. Jaan de denge lekin jhukenge nahi!","OAG"
"Pad Yatra now moving through New Colony in #Gurgaon. Do show your support by joining it. #AAP","NAG"
"(How about gifting DiDi a dictionary?) @ndtvvideos: After Calling Modi 'Donkey' Mamata Now Calls Him 'Danga babu'","OAG"
"""Exit poll. congress ka dabba gol""","CAG"
"Modi wave even in Kargil and Drass","NAG"
"Modi 'Raj' will be like 'Ram Rajya': Mukhtar Abbas Naqvi","NAG"
"Don't judge Muslims vote from Box office. Jai ho","NAG"
"MODI ji today's speech is touching marvellous and revolutionary. wade bhi hain iraade bhi hain","NAG"
"What AAP leader commented on Hazart imam Husain (AS) is not only objectionable but also hurt sentiment. AAP must apologise","OAG"
"Funny under the shadow of AmitShah Bokhiria Corruption Danga Encounter and Feku he accuses others of ABCD!","CAG"
"Encouraging dialogue among our kids with Juhi Chawla and the Indo-Pak team of #ExchangeForChange in New Delhi","NAG"
"The 14th Lok Sabha spent 1736 hours in discussion the 15th Lok Sabha a mere 1338 Hours","OAG"
"Indian secularists condemn Hindu fundamentalism but not Muslim fundamentalism: @taslimanasreen to me: http://ibnlive_in_com/news/indian-secularists-are-too-selective-in-their-protests-taslima-nasrin/452677-40-100_html. 1030pm","OAG"
"Jamia Millia Chaupal on @face_the_people: ""come and talk to us Mr Modi"": say students. http://ibnlive_in_com/videos/454768/","NAG"
"Telangana chaupal from Hussain Sagar lake in Hyderabad: ""Division is over now lets get united!"" http://ibnlive_in_com/videos/","NAG"
"Prashant Bhushan Hope now you know who you have aligned with !","CAG"
"No Vadra witch hunting -bjp No snoopgate probe - cong. Is this not MILI BHAGAT ?","CAG"
"I can see @nartc_b_468endramodi getting lot of airtime on Pak news channels as well!Is Pak scared? Or a propaganda. Unprecedented curiosity in Pak","CAG"
"Hafiz Saeed says @narendramodi dangerous for Muslims whereas he is serving Hindus in Pak. Good joke? http://youtu_be/FkqJ8_F56DY","CAG"
"Those rejoicing over M Ansari spprt 2 cong or shia spprt to kejriwal forget now it hs bcme a Hindu Muslim election. Sureshot victory fr Modi","NAG"
"Modi wanted Ansari to spprt the Congress. He wanted Muslim 2 spprt cong nd kejri. Now vote split. Both playing according to his script","CAG"
"Arvind Kejariwal now wants to escape running the govt using dharna against police as an excuse with eyes on Lok Sabha elections","OAG"
"Rahul Gandh asked Sheila Dixit: ""What is the reason of you defeat?"" She replied : ""AAP ""","NAG"
"By supporting AAP Congress is living up to its promise of ""Congress ka haat aam admi ke saath""","NAG"
"""No one can stop Modi from becoming PM"" says Ramvilas Paswan prompted by son Chirag in Aap Ki Adalat tonight at 10 on India TV","NAG"
"Recorded Aap Ki Adalat in Mumbai with @rajthakre asked him all questions being raised about him he had the courage to face uneasy questions","NAG"
"@ajaymaken pls send Rahulji to Aap Ki Adalat. I will ask him questions being raised by Narendra Modi in public domain. He can come prepared","CAG"
"@ajaymaken I asked Modi every question raised by Sonia Rahul Manmohan & Anand Sharma do you think their questions are not good enough?","CAG"
"Amit Shah finally breaks his silence on 'snoop gate' and 'fake encounters' in Aap Ki Adalat tonight at 10 on India TV","NAG"
"@dksardana @RajatSharmaLive: AAP MLA Vinod K Binny reveals Kejariwal involved in a secret deal with Congress to form govt In Aap Ki Adalat","OAG"
"In intrvw Modi ducked Q on why he used caste dropped claim that 'neech' referred to 'low caste' said PriGa the one using 'neech rajniti'","OAG"
"How Arvind Kejriwal survived the BJP's psychological warfare in Varanasi writes @rahulpandita http://thehindu.com/opinion/op-ed/","NAG"
"amazing to see how everyone draws huge crowd in Varanasi!!! time for pol activists to shift from Jantar Mantar/Ram lila maidan to Varanasi?","NAG"
"Adani Vadra Snoopgate Moin Qureshi Ambani Gas Pricing- all exposed by AAP & it's members. BJP Cong just using these for political mileage","CAG"
"Lunatic inhuman BJP goons have physically assaulted Ankit Lal & Nandan Misra (AAP members) while they were campaigning in Durgakund Varanasi","OAG"
"@sahiljoshii Nice joke I heard interviewer to lady : what is modiji's first name lady anwers : abkibar","NAG"
"Two Shankaracharyas to campaign against Narendra Modi in Varanasi http://m_economictimes_com/articleshow/34","NAG"
"RT @Jadui_Jhaadu: How AAP has gone beyond Modi vs Muslims in Varanasi http://scroll_in/article/663834","NAG"
"Priyanka Vadra ill-advised in saying 'neech'- ref @narendramodi Insulting! Amethi candidate remains in the periphery. Congress desperate?","NAG"
"Am sure @narendramodi is a v_worried man after AAP supporters substantially outnumbrd his rally of paid supporters!","CAG"
"One of our women volunteers has been harassed and assaulted by BJP workers outside Shanti Shiksha Niketan Newada #shameful","OAG"
"@punit134 @fanssay @del_irani @aplusindia With Lokpal NaMo wont be able to repay the invstmnt Ambani-Adani have made in his campaign!","CAG"
"Kashi has just seen a nautanki a farce by Arun Jaitley and Amit Shah. They could not bear heat of Varanasi","OAG"
"BJP is spreading lies. It's not EC who denied permission for Ganga Aarti but Pandas refused to do Ganga Aarti for Modi","OAG"
"Arun Jaitley is learning fast from Arvind Kejariwal. He will sit on dharna at BHU and will become an anarchist and do satyagraha. Great","CAG"
"Shah wants revenge. Giriraj sends modi critics Pakistan. Jyotsna MLA wants AAP volunteers thrown out. Togadia venom Ag Muslims. Fascist BJP","OAG"
"Action taken against Jaswant and Adwani for Jinnah statements but no action against Giriraj singh and Togadia because that is RSS ideology","CAG"
"Modi is a caste name. BJP campaign Ab Ki Bar Modi Sarkar' has castist overtone as per EC guidelines. EC should ban this","OAG"
"Varanasi Bjp MLA jyotsna Sriwastawa wants AAP volunteers to be thrown out from homes in front of Amit Shah. Does BJP endorse?","OAG"
"Arvind Kejriwal had met Swami Avimukteshwaranand to get his blessings!","NAG"
"Swami Vivekananda did a Bharat Parikrama and this gave him lot of strength. Mahatma Gandhi travelled across India to understand India: Modiji","NAG"
"#ADecadeOfGrowth in rape sexual assault and molestation cases and Fall in Women's Safety measures. Bahut Hua Atyachar #AbkiBaarModiSarkar","OAG"
"Suprabhat! Looking at some Official AAP tweets & the blatant LIE mongering to fool the public for votes. EC ko complain karna banta hai!","CAG"
"On Aaj Tak's Panchayat Sanjay Singh of AAP made a connotation that people of Benaras/Varanasi/Kashi are dangayiyee or Rioters in English","OAG"
"Nifty crosses 7000 Mark for the first time. Achhe din aane waale hain? ;-)","CAG"
"After Soniaji's scathing attack on Modi in Kushinagar BJP should consider changing its slogan to a more apt 'Oche din aane waale hain'","OAG"
"How can Narendra Modi be allowed to hold Ganga Aarti? Isn't use of religious symbols banned under the code of conduct?","CAG"
"Modi: After Rajiv Gandhi Desh has never given any Mazboot Sarkar. That means Atal led NDA Govt was not Mazboot and stable! #arnabwedsmodi","CAG"
"Smt Sonia Gandhi's pertinent question to Narendra Modi that even Vajpayee never insulted Rajiv Gandhi will put any Neta to shame! But Modi!","CAG"
"Someone from Varanasi told me what he heard at a kachori shop today. Ek poori Do Samosa Modi Tera Kya bharosa","CAG"
"Mr Modi uses Ram Rajya in Faizabad Amit Shah brands Azamgarh as terrorist haven; for India these are ominous signs of divisive politics","OAG"
"Modi Ji You are the epitome of ""neech rajniti""; the Gujarat massacres fake encounter killings SnoopGate corruption crony capitalism","OAG"
"Offered tributes to Bapu at Raj Ghat earlier today http://nm4.in/1nKmzmt","NAG"
"The visuals touched both Nawaz Sharif ji & his Mother. He told me that after seeing the visuals his Mother got very emotional","NAG"
"On my way to Atal ji's residence to seek his blessings","NAG"
"I will represent Varanasi in Lok Sabha & I look forward to this wonderful opportunity to serve Ganga Maa & work for Varanasi's development","NAG"
"Reached Gujarat Bhavan after the programmes at Rashtrapati Bhavan. Will begin my 1st official briefing meeting with officials shortly","NAG"
"Nawaz Sharif ji told me that he stays in Islamabad but goes to meet his Mother once in a week","NAG"
"Tomorrow will begin the day by visiting Raj Ghat & paying my respects to Pujya Bapu","NAG"
"Veer Savarkar is remembered as a prolific writer thinker poet & a social reformer. Leaving for Parliament to pay tributes to Veer Savarkar","NAG"
"Shri @narendramodi ji bid farewell to his home constituency of Maninagar. All citizens & karyakartas became emotional","NAG"
"News @IndiaToday ""Amit Shah: Modi's master strategist who shaped BJP's dreams""","NAG"
"News Article "" Amit Shah: Modi's man on Friday and forever"" @timesofindia","NAG"
"News Articles ""How Amit Shah Delivered Uttar Pradesh For the BJP"" http://tinyurl.com/mapvpgy","NAG"
"News: Amit Shah conquers Uttar Pradesh Narendra Modi upsurge breaches caste barriers @dna http://tinyurl.com/k6eqv5s","NAG"
"News @NewIndianXpress ""Amit Shah a Force to Reckon With""","NAG"
"Decoding Amit Shah's campaign: How he conquered Uttar Pradesh | Firstpost http://firstpost.com/politics/decoding-amit-shahs-campaign-how-he-conquered-uttar-pradesh-1538759.html via @Firstpost.com","NAG"
"My sincere tribute to the great Visionary of 21st century The messenger of peace prosperity and progress Bharat Ratna Rajiv Gandhi ji","NAG"
"Spoke to Nitin Gadkari today about scrapping Sethusamundram Project and declaring Rama Setu as national heritage monument","NAG"
"I think restoring Ahmedabad as Karnavati [Namo had recommended as CM] Aurangzeb Rd as Dara Shikoh Allahabad as Prayag is easy for govt","CAG"
"@colonel_anil @unkownindian @abdullah_omar : Kashmir is mine first because I am of Kashyapa gotra","OAG"
"@dhawalshah_ : Ram Rajya came only after the vanavas was completed","NAG"
"@SreeIyer1 : Issue was never Gopal's ability & personal integrity [Vyaktigat Charitra] but his Rashtra Charitra when he chose to rubbish Rama","OAG"
"@RKSwamy_BC : Sri Lankan Tamil Muslims easily merge in TN. The TN Porkis and Elis are now also receiving ISI money","OAG"
"I have finally decided upon a house offered by Sh Naren Jain in Civil Lines area. Thanks Naren ji","NAG"
"Very good meeting with Railway Minister Sadananda Gowda on Kerala's proposal for a Rapid Rail Transit Service between Thiruv'purm & Chengannur","NAG"
"visited Tauru in Mewat (haryana) today. It saw communal clashes first time since partition. Same story in Punhana last month. Its worrying","NAG"
"Quite a galaxy of lawyers came to defend me. Kamini Jaisawal. Prashant Bhushan. Rahul Mehra. Somnath Bharatiya. P S Sharda. Thanks to all","NAG"
"Tributes to the great patriot Veer Savarkar ji on his 131st Jayanti!!!","NAG"
"Remembering Sh. S P Mookerjee with great respect on his Punya Tithi. He sacrificed his life for removal of Art 370 from Kashmir","NAG"
"Congratulations to senior leader Smt Sumitra Mahajan on being elected as the Lok Sabha Speaker","NAG"
"Working with Sumitra ji in the parliament & in NDA cabinet led by Atal ji was a great learning experience for me","NAG"
"Leaving for Hazaribagh with @RajivPratapRudy tomorrow morning to see Mr. Yashwant Sinha who is behind bars for the 'Bijli Andolan'","NAG"
"In Aam Aadmi Party it seems 'khas Aadmis' are busy fighting each other. What's 'Aam Aadmi' got to do with this?","CAG"
"(Very Good initiative)@timesnow: PM Narendra Modi Home Minister Rajnath Singh and other BJP veterans attend BJP's 2 day orientation program","NAG"
"(achaa Shabaash UP Govt ) “@ZeeNews: UP cop transferred after minister booked in dacoity case. http://zeenews.india.com/news/","CAG"
"Here is our CHIEF! Our Leader. At RB Bhawan. Jai ho. Jai Bharat. Jai Hind","NAG"
"Sharing--Mata Vaishno Devi's well framed poster in the lounge of Jammu Airport. Its truly beautiful and divine","NAG"
"Reached out these girls of a govt school in Jammu. Inspiring them for post school-professional education/scholarships","NAG"
"(Thanku Godji) ""@IBNLiveRealtime: The meeting with Modi was excellent. Looking forward to a positive outcome: Pak PM Nawaz Sharif""","NAG"
"(We are all members of Indian Army with NAMO as Commander-In Chief!) ""@rohanlawate: @thekiranbedi We will be proud if u join NAMO ARMY""","NAG"
"(Congratulations. You were very valuable spokespersons too) @nsitharaman: Thank you @ShahnawazBJP ji .@PrakashJavdekar","NAG"
"India re-awakened.. It's got a 'Mahatma Modi' after Mahatma Gandhi Sardar Patel and Subhash Chander Bose to bring in VIKAS as an ANDOLAN!","NAG"
"Thanks to the people of Kargil & Ladakh for their vote & support to Bjp & Modi ji","NAG"
"BJP wins in Kargil Ladakh. Thanks to people of kargil & ladakh (J&k) for support and vote Modi & BJP","NAG"
"Digvijaya ji says ""Rahul not ruler by temperament"". Angoor khtte hai","CAG"
"'Class 12 pass' and education minister? No. Madhu Kishwar tells Smriti Irani http://firstpost.com/","CAG"
"Acquitted by SC Akshardham attack accused say they were framed by Gujarat Police. http://indianexpress.com/article/","NAG"
"India questions Narendra Modi in a powerful video: Will the promises be delivered? http://dnai.in/cdVv via @dna","NAG"
"@aparanjape @bibekdebroy it was Savarkar who led the conspiracy to assssinate Mahatma Gandhi in 1948","NAG"
"@kaaashif imasood loses giriraj wins in Tamil Nadu & odisha Muslims 10% bjp loses UP Assam Muslims 20% above BJP gains none in UP","NAG"
"@aparanjape @bibekdebroy justice jivan Lal Kapur known as Kapur commission n findings Savarkar was involved in the killing of Mahatma Gandhi","NAG"
"@aparanjape @bibekdebroy Savarkar rejected inclusive secular concept of terri nationalism advo exclusivst commu concept cultural nationalism","OAG"
